{
  "$schema": "https://pass.serp.co/schema/app-manifest-v1.json",
  "schema_version": 1,
  "publisher_id": "pub_invited_reference",
  "publisher_name": "Invited Publisher",
  "app_id": "app_invited_reference",
  "name": "Invited Publisher Reference Extension",
  "features": [
    "premium"
  ],
  "distributions": [
    {
      "browser_family": "chromium",
      "channel": "unpacked",
      "runtime_id": "deigfiokgenocbkifhkognjkhfljcfgi"
    }
  ]
}
